{
  "schemaVersion": "asi.agent-os.release-manifest.v1",
  "repository": "ASI-integration/asi-landing",
  "sourceBranch": "main",
  "baselineSha": "88f5c353719db6a59c266a44ed4f1be80270103b",
  "generatedAt": "2026-10-16T18:45:42.856Z",
  "package": {
    "name": "landing-asi",
    "version": "0.1.0"
  },
  "migrations": {
    "directory": "supabase/migrations",
    "count": 132
  },
  "activeGates": [
    {
      "id": "pr-validation",
      "workflow": ".github/workflows/pr-validation.yml"
    },
    {
      "id": "deploy-staging",
      "workflow": ".github/workflows/deploy-staging.yml"
    },
    {
      "id": "deploy-production",
      "workflow": ".github/workflows/deploy.yml"
    },
    {
      "id": "deploy-guestautopilot-production",
      "workflow": ".github/workflows/deploy-guestautopilot-production.yml"
    }
  ]
}
